{
  "schema_version": "1.0",
  "company_id": "U_DEMO_01",
  "questions": [
    {
      "key": "markets.sales_regions",
      "category": "markets",
      "question": "Компания зарегистрирована в регионе Москва. В каких регионах и странах вы продаёте основную часть продукции или услуг?",
      "why": "Региональные и страновые новости будут отбираться по вашим рынкам сбыта, а не только по месту регистрации",
      "priority": "high",
      "based_on": [
        "feature:region"
      ]
    },
    {
      "key": "markets.export_share",
      "category": "markets",
      "question": "По данным таможни вы ведёте внешнеэкономическую деятельность (Китай, Турция). Какая доля выручки приходится на экспорт и какая доля закупок — на импорт?",
      "why": "От этого зависит, чем для вас станет движение курса: риском для закупок или возможностью для экспортной выручки",
      "priority": "high",
      "based_on": [
        "feature:customs"
      ]
    },
    {
      "key": "seasonality.peak",
      "category": "seasonality",
      "question": "Есть ли в сегменте «Продукты питания и напитки» сезонность: в какие месяцы пик продаж и когда больше всего нужны оборотные деньги?",
      "why": "Новости о ставке, курсе и ценах на сырьё важнее перед сезоном закупок: сводка учтёт ваш календарь",
      "priority": "high",
      "based_on": [
        "feature:industry"
      ]
    },
    {
      "key": "products.main",
      "category": "products",
      "question": "Основной вид деятельности по ОКВЭД — «Торговля оптовая прочими пищевыми продуктами, включая рыбу, ракообразных и моллюсков». Какие продукты или услуги дают основную часть выручки?",
      "why": "Код ОКВЭД описывает деятельность грубо: по вашим продуктам отбор найдёт новости именно ваших рынков",
      "priority": "medium",
      "based_on": [
        "feature:industry"
      ]
    },
    {
      "key": "customers.main",
      "category": "customers",
      "question": "Кто ваши ключевые покупатели и из каких они отраслей? Можно без названий: отрасль и примерная доля оборота",
      "why": "Новость про рынок контрагента часто важнее отраслевой: спад у крупного покупателя бьёт по вашей выручке",
      "priority": "medium",
      "based_on": []
    },
    {
      "key": "suppliers.main",
      "category": "suppliers",
      "question": "Кто ваши ключевые поставщики и из каких они отраслей? Можно без названий: отрасль и примерная доля оборота",
      "why": "Новость про рынок контрагента часто важнее отраслевой: перебои и рост цен у поставщика бьют по вашим затратам",
      "priority": "medium",
      "based_on": []
    },
    {
      "key": "constraints.main",
      "category": "constraints",
      "question": "Что сейчас сильнее всего ограничивает бизнес: кадры, логистика, доступ к финансированию, регулирование, что-то ещё?",
      "why": "Сводка поднимет новости о том, что для вас узкое место",
      "priority": "medium",
      "based_on": []
    },
    {
      "key": "plans.next_year",
      "category": "plans",
      "question": "Какие планы на ближайший год: инвестиции, новые рынки, крупные закупки и финансирование?",
      "why": "Планы меняют, что для вас важно: перед кредитом — ставка, перед выходом на новый рынок — его регулирование",
      "priority": "low",
      "based_on": [
        "feature:debt_dependence"
      ]
    }
  ],
  "to_confirm": [
    {
      "schema_version": "1.0",
      "id": "draft:U_DEMO_01:products.industry",
      "company_id": "U_DEMO_01",
      "version": 1,
      "key": "products.industry",
      "category": "products",
      "text": "Основная деятельность: Торговля оптовая прочими пищевыми продуктами, включая рыбу, ракообразных и моллюсков (сегмент «Продукты питания и напитки»)",
      "value": "food",
      "source": "bank_data",
      "status": "assumption",
      "evidence": [
        "feature:industry"
      ],
      "deleted": false,
      "created_at": "2026-10-21T09:00:00Z"
    },
    {
      "schema_version": "1.0",
      "id": "draft:U_DEMO_01:company.size",
      "company_id": "U_DEMO_01",
      "version": 1,
      "key": "company.size",
      "category": "other",
      "text": "Выручка 18,2 млрд ₽ в год; Крупнейший бизнес: выручка от 15 млрд ₽",
      "value": "largest",
      "source": "bank_data",
      "status": "assumption",
      "evidence": [
        "feature:revenue",
        "feature:size"
      ],
      "deleted": false,
      "created_at": "2026-10-21T09:00:00Z"
    }
  ],
  "known": 0
}
